Año_lectivo;Zona;Provincia;Cod_Provincia;Cantón;Cod_Cantón;Parroquia;Cod_Parroquia;Nombre_Institución;AMIE;Área;Total_estudiantes;Promovidos;No promovidos;Abandono
2022-2023 Fin;Zona 6;AZUAY;1;CUENCA;101;HUAYNACAPAC;10107;ESCUELA DE EDUCACIÓN BÁSICA PARTICULAR INEBHYE;01H01812;Urbana;125;124;0;1
2022-2023 Fin;Zona 6;AZUAY;1;CUENCA;101;SININCAY;10167;ESCUELA DE EDUCACIÓN BÁSICA PARTICULAR SAN AGUSTÍN;01H01813;Rural;227;227;0;0
2022-2023 Fin;Zona 6;AZUAY;1;CUENCA;101;BELLAVISTA;10101;CENTRO DE EDUCACIÓN INICIAL PARTICULAR SAN MATEO;01H01815;Urbana;26;26;0;0
2022-2023 Fin;Zona 6;AZUAY;1;CUENCA;101;BELLAVISTA;10101;ESCUELA DE EDUCACIÓN BÁSICA PARTICULAR ARCO IRIS;01H01822;Urbana;197;197;0;0
2022-2023 Fin;Zona 6;AZUAY;1;CUENCA;101;TOTORACOCHA;10113;UNIDAD EDUCATIVA RICARDO MUÑOZ CHAVEZ;01H01825;Urbana;967;956;6;5
2022-2023 Fin;Zona 6;AZUAY;1;CUENCA;101;BAÑOS;10151;UNIDAD DE EDUCACIÓN ESPECIAL  NUESTROS NIÑOS;01H01829;Rural;7;7;0;0
2022-2023 Fin;Zona 6;AZUAY;1;CUENCA;101;HUAYNACAPAC;10107;CENTRO DE EDUCACIÓN INICIAL PARTICULAR PLANETA ÍNDIGO;01H01831;Urbana;15;15;0;0
2022-2023 Fin;Zona 6;AZUAY;1;CUENCA;101;EL VECINO;10105;CENTRO DE EDUCACIÓN INICIAL PARTICULAR RISAS Y CARICIAS DREAMERS;01H01834;Urbana;32;32;0;0
2022-2023 Fin;Zona 6;AZUAY;1;CUENCA;101;YANUNCAY;10114;CENTRO DE EDUCACIÓN INICIAL PARTICULAR FUNDACION DEL DEPORTE;01H01836;Urbana;54;53;0;1
2022-2023 Fin;Zona 6;AZUAY;1;CUENCA;101;SAN BLAS;10110;CENTRO DE EDUCACIÓN INICIAL PARTICULAR LOS PINOS;01H01837;Urbana;36;34;0;2
2022-2023 Fin;Zona 6;AZUAY;1;CUENCA;101;SUCRE;10112;CENTRO DE EDUCACION INICIAL PARTICULAR PRIMERAS HUELLAS CEDFI;01H01838;Urbana;50;49;0;1
2022-2023 Fin;Zona 6;AZUAY;1;CUENCA;101;BELLAVISTA;10101;CENTRO DE EDUCACIÓN INICIAL PARTICULAR PITUFOS;01H01839;Urbana;41;41;0;0
2022-2023 Fin;Zona 6;AZUAY;1;CUENCA;101;MONAY;10109;CENTRO DE EDUCACIÓN INICIAL PARTICULAR ARCO BALENO;01H01842;Urbana;26;25;0;1
2022-2023 Fin;Zona 6;AZUAY;1;GUALACEO;103;SAN JUAN;10357;UNIDAD EDUCATIVA DEL MILENIO PAIGUARA;01H01870;Rural;673;631;13;29
2022-2023 Fin;Zona 6;AZUAY;1;CUENCA;101;NULTI;10158;CENTRO DE EDUCACION INICIAL PARTICULAR GARABATOS;01H01884;Rural;30;30;0;0
2022-2023 Fin;Zona 6;AZUAY;1;CUENCA;101;SAN BLAS;10110;JUGART;01H01887;Urbana;26;25;0;1
2022-2023 Fin;Zona 6;AZUAY;1;CUENCA;101;BELLAVISTA;10101;ESCUELA DE EDUCACION BASICA PARTICULAR CALDERON ARELLANO CEICA;01H01888;Urbana;71;71;0;0
2022-2023 Fin;Zona 6;AZUAY;1;GUALACEO;103;GUALACEO;10350;NENES;01H01890;Urbana;60;60;0;0
2022-2023 Fin;Zona 6;AZUAY;1;CUENCA;101;TOTORACOCHA;10113;CENTRO DE EDUCACIÓN INICIAL MUNDO FELIZ;01H01891;Urbana;7;7;0;0
2022-2023 Fin;Zona 6;AZUAY;1;CUENCA;101;SUCRE;10112;CENTRO DE EDUCACIÓN INICIAL PARTICULAR PLANETA SUEÑOS;01H01970;Urbana;23;23;0;0
2022-2023 Fin;Zona 6;AZUAY;1;CUENCA;101;SUCRE;10112;CENTRO DE EDUCACIÓN INICIAL PARTICULAR  REINO MÁGICO;01H01971;Urbana;7;7;0;0
2022-2023 Fin;Zona 6;AZUAY;1;CUENCA;101;YANUNCAY;10114;CENTRO DE EDUCACIÓN INICIAL PARTICULAR MI RINCÓN CREATIVO;01H01972;Urbana;19;19;0;0
2022-2023 Fin;Zona 6;AZUAY;1;CUENCA;101;TOTORACOCHA;10113;CENTRO DE EDUCACIÓN INICIAL CARICIAS;01H01973;Urbana;12;11;0;1
2022-2023 Fin;Zona 6;AZUAY;1;CUENCA;101;SAN BLAS;10110;ESCUELA DE EDUCACIÓN BÁSICA PARTICULAR ESTRELLITAS CREATIVAS;01H01974;Urbana;41;41;0;0
2022-2023 Fin;Zona 6;AZUAY;1;CUENCA;101;YANUNCAY;10114;CENTRO DE EDUCACIÓN INICIAL  PARTICULAR CASITA DE CARAMELO;01H01975;Urbana;39;39;0;0
2022-2023 Fin;Zona 6;AZUAY;1;CUENCA;101;SUCRE;10112;CENTRO DE EDUCACIÓN INICIAL PARTICULAR LA ESCUELITA;01H01977;Urbana;31;31;0;0
2022-2023 Fin;Zona 6;AZUAY;1;CUENCA;101;SUCRE;10112;CENTRO DE EDUCACIÓN INICIAL PARTICULAR MUNDO DE JUGUETE;01H01980;Urbana;53;53;0;0
2022-2023 Fin;Zona 6;AZUAY;1;CUENCA;101;SAN SEBASTIAN;10111;CENTRO DE EDUCACIÓN INICIAL PARTICULAR PRIMEROS PASOS;01H01981;Urbana;48;48;0;0
2022-2023 Fin;Zona 6;AZUAY;1;CUENCA;101;EL BATAN;10103;CENTRO DE EDUCACIÓN INICIAL PARTICULAR ABEJITAS MÁGICAS;01H01984;Urbana;5;5;0;0
2022-2023 Fin;Zona 6;AZUAY;1;CUENCA;101;YANUNCAY;10114;CENTRO DE EDUCACIÓN INICIAL PARTICULAR CRECIENDO;01H01985;Urbana;1;1;0;0
2022-2023 Fin;Zona 6;AZUAY;1;CUENCA;101;CAÑARIBAMBA;10102;CENTRO DE EDUCACIÓN INICIAL PARTICULAR COLORINES;01H01986;Urbana;16;16;0;0
2022-2023 Fin;Zona 6;AZUAY;1;CUENCA;101;CAÑARIBAMBA;10102;CENTRO DE EDUCACIÓN INICIAL PARTICULAR JUNGLITA DEL SABER;01H01987;Urbana;7;7;0;0
2022-2023 Fin;Zona 6;AZUAY;1;CUENCA;101;HERMANO MIGUEL;10115;CENTRO DE EDUCACIÓN INICIAL PARTICULAR  MÁGICOS SUEÑOS;01H01988;Urbana;10;9;0;1
2022-2023 Fin;Zona 6;AZUAY;1;CUENCA;101;EL VECINO;10105;CENTRO DE EDUCACIÓN INICIAL PARTICULAR EL CASTILLO;01H01989;Urbana;6;6;0;0
2022-2023 Fin;Zona 6;AZUAY;1;CUENCA;101;HUAYNACAPAC;10107;CENTRO DE EDUCACIÓN INICIAL PARTICULAR CARRUSEL;01H01991;Urbana;87;87;0;0
2022-2023 Fin;Zona 6;AZUAY;1;CUENCA;101;HUAYNACAPAC;10107;ESCUELA DE EDUCACION BASICA PARTICULAR CRECER FELÍZ;01H01992;Urbana;20;20;0;0
2022-2023 Fin;Zona 6;AZUAY;1;CUENCA;101;CAÑARIBAMBA;10102;CENTRO DE EDUCACIÓN INICIAL PARTICULAR SAN ANDRES;01H01994;Urbana;17;16;0;1
2022-2023 Fin;Zona 6;AZUAY;1;CUENCA;101;YANUNCAY;10114;CENTRO DE EDUCACIÓN INICIAL PARTICULAR SANTA CATALINA LABOURE;01H01997;Urbana;15;15;0;0
2022-2023 Fin;Zona 6;AZUAY;1;CUENCA;101;YANUNCAY;10114;CENTRO DE EDUCACIÓN INICIAL PARTICULAR MI MUNDO MÁGICO;01H01998;Urbana;15;15;0;0
2022-2023 Fin;Zona 6;AZUAY;1;CUENCA;101;CAÑARIBAMBA;10102;CENTRO DE EDUCACION INICIAL PARTICULAR JUGUETONES;01H01999;Urbana;10;10;0;0
2022-2023 Fin;Zona 6;AZUAY;1;CUENCA;101;EL VECINO;10105;UNIDAD EDUCATIVA DEL MILENIO MANUEL J. CALLE;01H02001;Urbana;2220;2185;28;7
2022-2023 Fin;Zona 6;AZUAY;1;CUENCA;101;BAÑOS;10151;UNIDAD EDUCATIVA DEL MILENIO FRANCISCO FEBRES CORDERO;01H02002;Rural;1768;1760;8;0
2022-2023 Fin;Zona 6;AZUAY;1;CUENCA;101;MONAY;10109;UNIDAD EDUCATIVA DEL MILENIO MANUELA GARAICOA DE CALDERON;01H02003;Urbana;2463;2424;26;13
2022-2023 Fin;Zona 6;AZUAY;1;CUENCA;101;SUCRE;10112;CENTRO DE EDUCACIÓN INICIAL PARTICULAR MUNDO CREATIVO;01H02004;Urbana;4;3;0;1
2022-2023 Fin;Zona 6;AZUAY;1;CUENCA;101;HUAYNACAPAC;10107;CENTRO DE EDUCACIÓN INICIAL PARTICULAR SUEÑOS DE COLORES;01H02005;Urbana;10;10;0;0
2022-2023 Fin;Zona 6;AZUAY;1;CUENCA;101;SAYAUSI;10165;UNIDAD EDUCATIVA DEL MILENIO SAYAUSI;01H02006;Rural;1912;1838;39;35
2022-2023 Fin;Zona 6;AZUAY;1;CUENCA;101;CAÑARIBAMBA;10102;CENTRO DE EDUCACIÓN INICIAL PARTICULAR MI GENESIS;01H02007;Urbana;35;33;0;2
2022-2023 Fin;Zona 6;AZUAY;1;CUENCA;101;QUINGEO;10161;UNIDAD EDUCATIVA DEL MILENIO QUINGEO;01H02008;Rural;865;838;9;18
2022-2023 Fin;Zona 6;AZUAY;1;CUENCA;101;YANUNCAY;10114;CENTRO DE EDUCACIÓN INICIAL PARTICULAR CLAP CLAP KINDER KIDS;01H02009;Urbana;28;26;0;2
2022-2023 Fin;Zona 6;AZUAY;1;CUENCA;101;YANUNCAY;10114;CENTRO DE EDUCACIÓN INICIAL PARTICULAR EL SABER;01H02010;Urbana;22;22;0;0
2022-2023 Fin;Zona 6;AZUAY;1;CUENCA;101;HUAYNACAPAC;10107;ESCUELA DE EDUCACIÓN BÁSICA PARTICULAR NEW SONG GARDEN;01H02011;Urbana;28;28;0;0
2022-2023 Fin;Zona 6;AZUAY;1;CUENCA;101;RICAURTE;10162;CENTRO DE EDUCACIÓN INICIAL PARTICULAR AVENTURA KIDS;01H02012;Rural;12;12;0;0
2022-2023 Fin;Zona 6;AZUAY;1;CAMILO PONCE ENRIQUEZ;115;CAMILO PONCE ENRIQUEZ;11550;ESCUELA DE EDUCACIÓN BÁSICA LUZ DE AMÉRICA;01H02013;Urbana;11;11;0;0
2022-2023 Fin;Zona 6;AZUAY;1;CUENCA;101;SAN SEBASTIAN;10111;CENTRO DE EDUCACIÓN INICIAL PARTICULAR BRILLANDO CON LUZ PROPIA PASO A PASO;01H02014;Urbana;17;16;0;1
2022-2023 Fin;Zona 6;AZUAY;1;CUENCA;101;RICAURTE;10162;CENTRO DE EDUCACIÓN INICIAL PARTICULAR ABC SUEÑOS MAGICOS;01H02015;Rural;76;75;0;1
2022-2023 Fin;Zona 6;AZUAY;1;CUENCA;101;RICAURTE;10162;CENTRO DE EDUCACIÓN INICIAL PARTICULAR SEABYS;01H02016;Rural;10;10;0;0
2022-2023 Fin;Zona 6;AZUAY;1;CUENCA;101;HUAYNACAPAC;10107;UNIDAD EDUCATIVA PARTICULAR NOVUS HIGH SCHOOL PCEI;01H02017;Urbana;238;226;1;11
2022-2023 Fin;Zona 6;AZUAY;1;CUENCA;101;NULTI;10158;ESCUELA DE EDUCACIÓN BÁSICA PARTICULAR LACROSS;01H02018;Rural;169;169;0;0
2022-2023 Fin;Zona 6;AZUAY;1;CUENCA;101;SAN SEBASTIAN;10111;CEI PARTICULAR COOP DE SERVICIOS EDUCACIONALES JARDIN ESPERANZA;01H02019;Urbana;12;12;0;0
2022-2023 Fin;Zona 6;AZUAY;1;CUENCA;101;SAYAUSI;10165;ESCUELA DE EDUCACIÓN BÁSICA PARTICULAR SAN PEDRO DE SAYAUSÍ;01H02020;Rural;33;31;0;2
2022-2023 Fin;Zona 6;AZUAY;1;CUENCA;101;SAN BLAS;10110;CENTRO DE EDUCACIÓN INICIAL PARTICULAR JARDÍN DE SUEÑOS;01H02022;Urbana;5;5;0;0
2022-2023 Fin;Zona 6;AZUAY;1;CUENCA;101;RICAURTE;10162;CENTRO DE EDUCACIÓN INICIAL PARTICULAR SAN CARLOS;01H02023;Rural;29;28;0;1
2022-2023 Fin;Zona 6;AZUAY;1;CUENCA;101;HERMANO MIGUEL;10115;CENTRO DE EDUCACIÓN INICIAL PARTICULAR LOS DELFINES;01H02025;Urbana;44;44;0;0
2022-2023 Fin;Zona 6;AZUAY;1;CUENCA;101;MONAY;10109;CENTRO DE EDUCACIÓN INICIAL PARTICULAR KINDERGARDEN CANGURITOS;01H02026;Urbana;73;73;0;0
2022-2023 Fin;Zona 6;AZUAY;1;CUENCA;101;HUAYNACAPAC;10107;CENTRO DE EDUCACIÓN INICIAL PARTICULAR CEIAP (CENTRO DE ESTIMULACIÓN INTEGRAL Y APOYO PSICOTERAPÉUTICO) DE LA UNIVERSIDAD DEL AZUAY;01H02027;Urbana;91;87;0;4
2022-2023 Fin;Zona 6;AZUAY;1;CUENCA;101;SAN SEBASTIAN;10111;CENTRO DE EDUCACIÓN INICIAL PEKE BOSQUE;01H02028;Urbana;14;14;0;0
2022-2023 Fin;Zona 6;AZUAY;1;CUENCA;101;BAÑOS;10151;UNIDAD EDUCATIVA PARTICULAR LICEO FRANCES LOUIS GODIN;01H02029;Rural;98;98;0;0
2022-2023 Fin;Zona 6;AZUAY;1;CUENCA;101;EL BATAN;10103;CENTRO DE EDUCACIÓN INICIAL PARTICULAR EL COLIBRÍ;01H02031;Urbana;12;12;0;0
2022-2023 Fin;Zona 6;AZUAY;1;CUENCA;101;BAÑOS;10151;ESCUELA DE EDUCACIÓN BÁSICA PARTICULAR HOPESEED SCHOOL;01H02033;Rural;4;4;0;0
2022-2023 Fin;Zona 6;AZUAY;1;CUENCA;101;NULTI;10158;CENTRO DE EDUCACIÓN INICIAL PARTICULAR LE GOS;01H02035;Rural;2;2;0;0
2022-2023 Fin;Zona 6;AZUAY;1;CUENCA;101;MONAY;10109;CENTRO DE EDUCACIÓN INICIAL PARTICULAR LIRÓN LIRÓN;01H02036;Urbana;27;27;0;0
2022-2023 Fin;Zona 6;AZUAY;1;CUENCA;101;BELLAVISTA;10101;CENTRO DE EDUCACIÓN INICIAL MUNICIPAL SANTA FE DE MIRAFLORES;01H02037;Urbana;12;12;0;0
2022-2023 Fin;Zona 6;AZUAY;1;CUENCA;101;RICAURTE;10162;CENTRO DE EDUCACIÓN INICIAL PARTICULAR PEQUEÑOS PASOS;01H02038;Rural;9;9;0;0
2022-2023 Fin;Zona 6;AZUAY;1;CUENCA;101;GIL RAMIREZ DAVALOS;10106;CENTRO DE EDUCACION INICIAL PARTICULAR PAKARINA;01H02039;Urbana;8;8;0;0
2022-2023 Fin;Zona 6;AZUAY;1;CUENCA;101;MACHANGARA;10108;CENTRO DE EDUCACIÓN INICIAL PARTICULAR SEMILLITAS;01H02040;Urbana;10;10;0;0
2022-2023 Fin;Zona 6;AZUAY;1;CUENCA;101;YANUNCAY;10114;CENTRO DE EDUCACIÓN INICIAL PARTICULAR MIS PRIMEROS PASITOS;01H02041;Urbana;20;20;0;0
2022-2023 Fin;Zona 6;AZUAY;1;CUENCA;101;YANUNCAY;10114;CENTRO DE EDUCACIÓN INICIAL MIS PEQUEÑOS PANDAS;01H02042;Urbana;26;26;0;0
2022-2023 Fin;Zona 6;CAÑAR;3;CAÑAR;303;GUALLETURO;30354;CECIB DE EDUCACION BASICA CAMPO ALEGRE;03B00001;Rural;5;5;0;0
2022-2023 Fin;Zona 6;CAÑAR;3;BIBLIAN;302;BIBLIAN;30250;CENTRO EDUCATIVO COMUNITARIO INTERCULTURAL BILINGÜE DE EDUCACIÓN BÁSICA JOSE BENIGNO IGLESIAS;03B00004;Urbana;11;11;0;0
2022-2023 Fin;Zona 6;CAÑAR;3;BIBLIAN;302;JERUSALEN;30254;CENTRO EDUCATIVO COMUNITARIO INTERCULTURAL BILINGÜE JOSE BENIGNO CASTRO;03B00005;Rural;8;8;0;0
2022-2023 Fin;Zona 6;CAÑAR;3;CAÑAR;303;CAÑAR;30350;CECIB DE EDUCACION BASICA ANTONIO GUAMAN ZHININ;03B00007;Urbana;1;1;0;0
2022-2023 Fin;Zona 6;CAÑAR;3;CAÑAR;303;CAÑAR;30350;CECIB DE EDUCACION BASICA JOSE ANTONIO NEIRA;03B00008;Urbana;3;2;0;1
2022-2023 Fin;Zona 6;CAÑAR;3;CAÑAR;303;CAÑAR;30350;CECIB DE EDUCACION BASICA JOSE ANTONIO CAIZAN MAINATO;03B00009;Urbana;37;36;0;1
2022-2023 Fin;Zona 6;CAÑAR;3;CAÑAR;303;CAÑAR;30350;CECIB DE EDUCACION BASICA LA POSTA;03B00010;Urbana;10;10;0;0
2022-2023 Fin;Zona 6;CAÑAR;3;CAÑAR;303;CAÑAR;30350;CECIB DE EDUCACION BASICA SAN ANTONIO;03B00016;Urbana;15;15;0;0
2022-2023 Fin;Zona 6;CAÑAR;3;CAÑAR;303;CHONTAMARCA;30351;CECIB DE EDUCACION BASICA LORENZA ABIMAÑAY;03B00020;Rural;6;6;0;0
2022-2023 Fin;Zona 6;CAÑAR;3;CAÑAR;303;CHONTAMARCA;30351;CECIB DE EDUCACION BASICA JUAN MANUEL LEMA;03B00021;Rural;9;9;0;0
2022-2023 Fin;Zona 6;CAÑAR;3;CAÑAR;303;CHONTAMARCA;30351;CECIB DE EDUCACION BASICA INTI RAYMI;03B00022;Rural;4;4;0;0
2022-2023 Fin;Zona 6;CAÑAR;3;CAÑAR;303;CHONTAMARCA;30351;CECIB DE EDUCACION BASICA 24 DE JULIO;03B00024;Rural;14;14;0;0
2022-2023 Fin;Zona 6;CAÑAR;3;CAÑAR;303;CHONTAMARCA;30351;CECIB DE EDUCACION BASICA FERNANDO DAQUILEMA;03B00025;Rural;3;3;0;0
2022-2023 Fin;Zona 6;CAÑAR;3;CAÑAR;303;GENERAL MORALES (SOCARTE);30353;CECIB DE EDUCACION BASICA INTI PAKARI;03B00030;Rural;11;11;0;0
2022-2023 Fin;Zona 6;CAÑAR;3;CAÑAR;303;GENERAL MORALES (SOCARTE);30353;CECIB DE EDUCACION BASICA JAIME ROLDOS AGUILERA;03B00031;Rural;29;29;0;0
2022-2023 Fin;Zona 6;CAÑAR;3;CAÑAR;303;GENERAL MORALES (SOCARTE);30353;UNIDAD EDUCATIVA COMUNITARIA INTERCULTURAL BILINGÜE PACHAKUTIK;03B00032;Rural;100;99;0;1
2022-2023 Fin;Zona 6;CAÑAR;3;CAÑAR;303;GENERAL MORALES (SOCARTE);30353;CECIB DE EDUCACION BASICA DOLORES CACUANGO;03B00033;Rural;8;8;0;0
2022-2023 Fin;Zona 6;CAÑAR;3;CAÑAR;303;GENERAL MORALES (SOCARTE);30353;CECIB DE EDUCACION BASICA JOSE JOAQUIN DE OLMEDO;03B00034;Rural;8;8;0;0
2022-2023 Fin;Zona 6;CAÑAR;3;CAÑAR;303;GENERAL MORALES (SOCARTE);30353;CECIB DE EDUCACION BASICA TUPAK KATARI;03B00035;Rural;30;30;0;0
2022-2023 Fin;Zona 6;CAÑAR;3;CAÑAR;303;GENERAL MORALES (SOCARTE);30353;CECIB DE EDUCACION BASICA TUPAK AMARU;03B00036;Rural;8;8;0;0
2022-2023 Fin;Zona 6;CAÑAR;3;CAÑAR;303;GENERAL MORALES (SOCARTE);30353;CECIB DE EDUCACION BASICA FRAY VICENTE SOLANO;03B00037;Rural;18;18;0;0
2022-2023 Fin;Zona 6;CAÑAR;3;CAÑAR;303;GENERAL MORALES (SOCARTE);30353;CECIB DE EDUCACION BASICA TOCTE PAMBA;03B00038;Rural;11;11;0;0
2022-2023 Fin;Zona 6;CAÑAR;3;CAÑAR;303;GENERAL MORALES (SOCARTE);30353;CECIB DE EDUCACION BASICA NINA PAKARI;03B00039;Rural;74;74;0;0
2022-2023 Fin;Zona 6;CAÑAR;3;CAÑAR;303;GENERAL MORALES (SOCARTE);30353;CECIB DE EDUCACION BASICA ELEUTERIO SIGÜENCIA SIGÜENCIA;03B00040;Rural;8;8;0;0
2022-2023 Fin;Zona 6;CAÑAR;3;CAÑAR;303;GENERAL MORALES (SOCARTE);30353;CECIB DE EDUCACION BASICA ELOY ALFARO;03B00041;Rural;26;26;0;0
2022-2023 Fin;Zona 6;CAÑAR;3;CAÑAR;303;GENERAL MORALES (SOCARTE);30353;CECIB DE EDUCACION BASICA 10 DE NOVIEMBRE;03B00042;Rural;6;6;0;0
2022-2023 Fin;Zona 6;CAÑAR;3;CAÑAR;303;GUALLETURO;30354;CECIB DE EDUCACION BASICA MINAS DE ORO;03B00043;Rural;48;42;4;2
2022-2023 Fin;Zona 6;CAÑAR;3;CAÑAR;303;GUALLETURO;30354;UNIDAD EDUCATIVA COMUNITARIA INTERCULTURAL BILINGÜE ANGEL MARIA IGLESIAS;03B00045;Rural;166;162;0;4
2022-2023 Fin;Zona 6;CAÑAR;3;CAÑAR;303;GUALLETURO;30354;CECIB DE EDUCACION BASICA 10 DE AGOSTO;03B00046;Rural;20;20;0;0
2022-2023 Fin;Zona 6;CAÑAR;3;CAÑAR;303;GUALLETURO;30354;CECIB DE EDUCACION BASICA SAGRADO CORAZON DE JESUS;03B00047;Rural;11;11;0;0
2022-2023 Fin;Zona 6;CAÑAR;3;CAÑAR;303;INGAPIRCA;30356;CECIB DE EDUCACION BASICA DANIEL CLAVIJO IGLESIAS;03B00048;Rural;64;64;0;0
2022-2023 Fin;Zona 6;CAÑAR;3;CAÑAR;303;INGAPIRCA;30356;CECIB DE EDUCACION BASICA SAN JOSE DE CULEBRILLAS;03B00050;Rural;21;21;0;0
2022-2023 Fin;Zona 6;CAÑAR;3;CAÑAR;303;INGAPIRCA;30356;UNIDAD EDUCATIVA COMUNITARIA INTERCULTURAL BILINGÜE SISID;03B00054;Rural;161;159;0;2
2022-2023 Fin;Zona 6;CAÑAR;3;CAÑAR;303;JUNCAL;30357;UNIDAD EDUCATIVA COMUNITARIA INTERCULTURAL BILINGÜE JUNCAL;03B00058;Rural;55;49;2;4
2022-2023 Fin;Zona 6;CAÑAR;3;CAÑAR;303;VENTURA;30362;CECIB DE EDUCACION BASICA LUZ DE AMERICA;03B00061;Rural;11;11;0;0
2022-2023 Fin;Zona 6;CAÑAR;3;EL TAMBO;305;EL TAMBO;30550;CECIB DE EDUCACION BASICA SAN JOSE DE ROMERILLO;03B00065;Urbana;21;21;0;0
2022-2023 Fin;Zona 6;CAÑAR;3;EL TAMBO;305;EL TAMBO;30550;CECIB DE EDUCACION BASICA CULEBRILLAS;03B00066;Urbana;35;35;0;0
2022-2023 Fin;Zona 6;CAÑAR;3;EL TAMBO;305;EL TAMBO;30550;CECIB DE EDUCACION BASICA LAZARO CONDO;03B00067;Urbana;29;27;0;2
2022-2023 Fin;Zona 6;CAÑAR;3;EL TAMBO;305;EL TAMBO;30550;UNIDAD EDUCATIVA COMUNITARIA INTERCULTURAL BILINGÜE UE FISCOMISIONAL MUSHUK KAWSAY;03B00069;Urbana;240;233;2;5
2022-2023 Fin;Zona 6;CAÑAR;3;EL TAMBO;305;EL TAMBO;30550;CECIB DE EDUCACION BASICA 20 DE AGOSTO;03B00071;Urbana;5;5;0;0
2022-2023 Fin;Zona 6;CAÑAR;3;SUSCAL;307;SUSCAL;30750;CECIB DE EDUCACION BASICA RUMIÑAHUI;03B00076;Urbana;8;8;0;0
2022-2023 Fin;Zona 6;CAÑAR;3;SUSCAL;307;SUSCAL;30750;UNIDAD EDUCATIVA COMUNITARIA INTERCULTURAL BILINGÜE SUSCAL;03B00077;Urbana;359;350;0;9
2022-2023 Fin;Zona 6;CAÑAR;3;CAÑAR;303;CHONTAMARCA;30351;CECIB DE EDUCACION BASICA EL ROSARIO;03B00121;Rural;12;12;0;0
2022-2023 Fin;Zona 6;CAÑAR;3;CAÑAR;303;GENERAL MORALES (SOCARTE);30353;CECIB DE EDUCACION BASICA LA INDUSTRIA;03B00122;Rural;10;10;0;0
2022-2023 Fin;Zona 6;CAÑAR;3;CAÑAR;303;GUALLETURO;30354;CECIB DE EDUCACION BASICA GER;03B00123;Rural;90;81;0;9
2022-2023 Fin;Zona 6;CAÑAR;3;CAÑAR;303;GUALLETURO;30354;CECIB DE EDUCACIÓN BÁSICA GULAG ALTO;03B00124;Rural;45;44;0;1
2022-2023 Fin;Zona 6;CAÑAR;3;CAÑAR;303;GUALLETURO;30354;CECIB DE EDUCACION BASICA 24 DE MAYO;03B00125;Rural;8;6;0;2
2022-2023 Fin;Zona 6;CAÑAR;3;SUSCAL;307;SUSCAL;30750;CECIB DE EDUCACION BASICA CERCAPATA;03B00126;Urbana;21;21;0;0
2022-2023 Fin;Zona 6;CAÑAR;3;SUSCAL;307;SUSCAL;30750;CECIB DE EDUCACION BASICA JOSE ERNESTO SUMBA SAULA;03B00127;Urbana;2;2;0;0
2022-2023 Fin;Zona 6;CAÑAR;3;CAÑAR;303;CAÑAR;30350;UNIDAD EDUCATIVA COMUNITARIA INTERCULTURAL BILINGÜE QUILLOAC;03B00133;Urbana;305;296;0;9
2022-2023 Fin;Zona 6;CAÑAR;3;CAÑAR;303;HONORATO VASQUEZ (TAMBO VIEJO);30355;CECIB DE EDUCACION BASICA JUAN JOSE BUÑAY BUÑAY;03B00134;Rural;12;12;0;0
2022-2023 Fin;Zona 6;CAÑAR;3;CAÑAR;303;INGAPIRCA;30356;CECIB DE EDUCACION BASICA SANTIAGO VASQUEZ;03B00135;Rural;41;40;1;0
2022-2023 Fin;Zona 6;CAÑAR;3;CAÑAR;303;GUALLETURO;30354;CECIB DE EDUCACION BASICA 15 DE ABRIL;03B00199;Rural;25;25;0;0
2022-2023 Fin;Zona 6;CAÑAR;3;AZOGUES;301;AURELIO BAYAS MARTINEZ;30101;ESCUELA DE EDUCACIÓN BÁSICA OSWALDO IDROVO VÁSQUEZ;03H00001;Urbana;4;4;0;0
2022-2023 Fin;Zona 6;CAÑAR;3;AZOGUES;301;AURELIO BAYAS MARTINEZ;30101;ESCUELA DE EDUCACIÓN BÁSICA GUILLERMINA ORDOÑEZ;03H00002;Urbana;22;22;0;0
2022-2023 Fin;Zona 6;CAÑAR;3;AZOGUES;301;AURELIO BAYAS MARTINEZ;30101;ESCUELA DE EDUCACIÓN BÁSICA GASTÓN CASTANIER CRESPO;03H00003;Urbana;8;8;0;0
2022-2023 Fin;Zona 6;CAÑAR;3;AZOGUES;301;AURELIO BAYAS MARTINEZ;30101;ESCUELA DE EDUCACIÓN BÁSICA MANUEL SEGUNDO ORMAZA;03H00005;Urbana;27;27;0;0
2022-2023 Fin;Zona 6;CAÑAR;3;AZOGUES;301;AURELIO BAYAS MARTINEZ;30101;UNIDAD EDUCATIVA CARLOS LENIN AVILA;03H00010;Urbana;123;115;0;8
2022-2023 Fin;Zona 6;CAÑAR;3;AZOGUES;301;AURELIO BAYAS MARTINEZ;30101;ESCUELA DE EDUCACIÓN BÁSICA QUITO N 9;03H00011;Urbana;134;134;0;0
2022-2023 Fin;Zona 6;CAÑAR;3;AZOGUES;301;AZOGUES;30102;UNIDAD EDUCATIVA JUAN BAUTISTA VASQUEZ;03H00014;Urbana;1792;1768;10;14
2022-2023 Fin;Zona 6;CAÑAR;3;AZOGUES;301;BORRERO;30103;SANTA MARIANITA DE BORRERO;03H00018;Urbana;289;275;13;1
2022-2023 Fin;Zona 6;CAÑAR;3;AZOGUES;301;BORRERO;30103;UNIDAD EDUCATIVA FISCOMISIONAL EMILIA MERCHAN;03H00023;Urbana;420;420;0;0
2022-2023 Fin;Zona 6;CAÑAR;3;AZOGUES;301;SAN FRANCISCO;30104;UNIDAD EDUCATIVA PARTICULAR SAN DIEGO DE ALCALA;03H00026;Urbana;473;473;0;0
2022-2023 Fin;Zona 6;CAÑAR;3;AZOGUES;301;AZOGUES;30102;ESCUELA DE EDUCACIÓN BÁSICA 4 DE NOVIEMBRE;03H00029;Urbana;171;171;0;0
2022-2023 Fin;Zona 6;CAÑAR;3;AZOGUES;301;AZOGUES;30102;ESCUELA DE EDUCACION BASICA SAN FRANCISCO DE PELEUSI DE AZOGUES;03H00030;Urbana;1146;1084;41;21
2022-2023 Fin;Zona 6;CAÑAR;3;AZOGUES;301;AZOGUES;30102;UNIDAD EDUCATIVA 16 DE ABRIL;03H00031;Urbana;1117;1110;0;7
2022-2023 Fin;Zona 6;CAÑAR;3;AZOGUES;301;AZOGUES;30102;UNIDAD EDUCATIVA UNE;03H00032;Urbana;438;437;1;0
2022-2023 Fin;Zona 6;CAÑAR;3;AZOGUES;301;AZOGUES;30102;ROBERTO RODAS;03H00034;Urbana;210;175;23;12
2022-2023 Fin;Zona 6;CAÑAR;3;AZOGUES;301;AZOGUES;30102;ESCUELA DE EDUCACIÓN BÁSICA DOLORES SUCRE;03H00041;Urbana;539;520;4;15
2022-2023 Fin;Zona 6;CAÑAR;3;AZOGUES;301;AZOGUES;30102;UNIDAD DE EDUCACION ESPECIAL MANUELA ESPEJO;03H00046;Urbana;95;95;0;0
2022-2023 Fin;Zona 6;CAÑAR;3;AZOGUES;301;AZOGUES;30102;UNIDAD EDUCATIVA FISCOMISIONAL SEMIPRESENCIAL PCEI DEL CAÑAR;03H00049;Urbana;119;62;0;57
2022-2023 Fin;Zona 6;CAÑAR;3;AZOGUES;301;AZOGUES;30102;CENTRO DE EDUCACIÓN INICIAL ALONSO TORRES;03H00052;Urbana;182;182;0;0
2022-2023 Fin;Zona 6;CAÑAR;3;AZOGUES;301;AZOGUES;30102;CENTRO DE EDUCACIÓN INICIAL MARIA MONTESSORI;03H00053;Urbana;354;354;0;0
2022-2023 Fin;Zona 6;CAÑAR;3;AZOGUES;301;AZOGUES;30102;UNIDAD EDUCATIVA LUIS CORDERO;03H00055;Urbana;2275;2275;0;0
2022-2023 Fin;Zona 6;CAÑAR;3;AZOGUES;301;AZOGUES;30102;ESCUELA DE EDUCACIÓN BÁSICA EMILIO ABAD;03H00061;Urbana;1307;1290;16;1
2022-2023 Fin;Zona 6;CAÑAR;3;AZOGUES;301;AZOGUES;30102;ESCUELA DE EDUCACIÓN BASICA MANUEL MUÑOZ CORDERO;03H00065;Urbana;450;431;13;6
2022-2023 Fin;Zona 6;CAÑAR;3;AZOGUES;301;AZOGUES;30102;UNIDAD EDUCATIVA FISCOMISIONAL LA SALLE;03H00073;Urbana;647;647;0;0
2022-2023 Fin;Zona 6;CAÑAR;3;AZOGUES;301;AZOGUES;30102;UNIDAD EDUCATIVA PARTICULAR  LA PROVIDENCIA;03H00075;Urbana;1717;1709;8;0
2022-2023 Fin;Zona 6;CAÑAR;3;AZOGUES;301;AZOGUES;30102;UNIDAD EDUCATIVA LUIS ROGERIO GONZÁLEZ;03H00076;Urbana;1338;1301;30;7
2022-2023 Fin;Zona 6;CAÑAR;3;AZOGUES;301;COJITAMBO;30151;ESCUELA DE EDUCACIÓN BÁSICA SEMIRA BAYAS;03H00082;Rural;6;6;0;0
2022-2023 Fin;Zona 6;CAÑAR;3;AZOGUES;301;COJITAMBO;30151;ESCUELA DE EDUCACIÓN BASICA LEOPOLDO CORDERO ALVARADO;03H00084;Rural;33;33;0;0
2022-2023 Fin;Zona 6;CAÑAR;3;CAÑAR;303;CHONTAMARCA;30351;ESCUELA DE EDUCACION BASICA MANUEL UTRERAS GOMEZ;03H00085;Rural;50;50;0;0
2022-2023 Fin;Zona 6;CAÑAR;3;AZOGUES;301;COJITAMBO;30151;DR ALBERTO GABRIEL SANCHEZ LUNA;03H00086;Rural;175;165;8;2
2022-2023 Fin;Zona 6;CAÑAR;3;AZOGUES;301;COJITAMBO;30151;ESCUELA DE EDUCACIÓN BASICA DR EULOGIO ASTUDILLO CORDERO;03H00089;Rural;150;144;1;5
2022-2023 Fin;Zona 6;CAÑAR;3;AZOGUES;301;COJITAMBO;30151;ESCUELA DE EDUCACIÓN BÁSICA COJITAMBO;03H00092;Rural;185;177;1;7
2022-2023 Fin;Zona 6;CAÑAR;3;AZOGUES;301;COJITAMBO;30151;ESCUELA DE EDUCACIÓN BÁSICA LUIS AURELIO OCHOA;03H00093;Rural;11;11;0;0
2022-2023 Fin;Zona 6;CAÑAR;3;AZOGUES;301;COJITAMBO;30151;ESCUELA DE EDUCACIÓN BÁSICA CAP. JUAN JOSE SALINAS;03H00097;Rural;12;12;0;0
2022-2023 Fin;Zona 6;CAÑAR;3;AZOGUES;301;COJITAMBO;30151;ESCUELA DE EDUCACIÓN BASICA PEDRO  MONCAYO;03H00100;Rural;10;10;0;0
2022-2023 Fin;Zona 6;CAÑAR;3;AZOGUES;301;GUAPAN;30153;ESCUELA DE EDUCACIÓN BÁSICA JOSÉ ANTONIO AVILA REGALADO;03H00105;Rural;10;8;0;2
2022-2023 Fin;Zona 6;CAÑAR;3;AZOGUES;301;GUAPAN;30153;UNIDAD EDUCATIVA GUAPAN;03H00106;Rural;442;414;7;21
2022-2023 Fin;Zona 6;CAÑAR;3;AZOGUES;301;GUAPAN;30153;ESCUELA DE EDUCACIÓN BÁSICA HONORIO DOMÍNGUEZ CORDERO;03H00107;Rural;60;60;0;0
2022-2023 Fin;Zona 6;CAÑAR;3;AZOGUES;301;GUAPAN;30153;CENTRO DE EDUCACIÓN INICIAL MIGUEL TOLEDO;03H00110;Rural;5;5;0;0
2022-2023 Fin;Zona 6;CAÑAR;3;AZOGUES;301;GUAPAN;30153;ESCUELA DE EDUCACIÓN BÁSICA REPUBLICA DEL ECUADOR;03H00111;Rural;188;183;0;5
2022-2023 Fin;Zona 6;CAÑAR;3;AZOGUES;301;GUAPAN;30153;ESCUELA DE EDUCACION BASICA AMBATO;03H00112;Rural;41;41;0;0
2022-2023 Fin;Zona 6;CAÑAR;3;AZOGUES;301;GUAPAN;30153;ESCUELA DE EDUCACIÓN BÁSICA MARCELO ESPINOZA CALLE;03H00118;Rural;41;41;0;0
2022-2023 Fin;Zona 6;CAÑAR;3;AZOGUES;301;GUAPAN;30153;ESCUELA DE EDUCACIÓN BÁSICA FRANCISCO CRESPO TRELLES;03H00119;Rural;39;36;0;3
2022-2023 Fin;Zona 6;CAÑAR;3;AZOGUES;301;GUAPAN;30153;ESCUELA DE EDUCACIÓN BÁSICA ORIENTE ECUATORIANO;03H00120;Rural;105;105;0;0
2022-2023 Fin;Zona 6;CAÑAR;3;AZOGUES;301;GUAPAN;30153;FRANCISCO MAYANCELA JAIGUA;03H00121;Rural;8;7;0;1
2022-2023 Fin;Zona 6;CAÑAR;3;AZOGUES;301;GUAPAN;30153;ESCUELA DE EDUCACIÓN BÁSICA VICTOR URGILES ALVARADO;03H00122;Rural;35;34;0;1
2022-2023 Fin;Zona 6;CAÑAR;3;AZOGUES;301;JAVIER LOYOLA (CHUQUIPATA);30154;ESCUELA DE EDUCACIÓN BÁSICA ENRIQUE VACAS GALINDO;03H00127;Rural;44;42;0;2
2022-2023 Fin;Zona 6;CAÑAR;3;AZOGUES;301;JAVIER LOYOLA (CHUQUIPATA);30154;ESCUELA DE EDUCACIÓN BASICA BRASIL;03H00128;Rural;7;7;0;0
2022-2023 Fin;Zona 6;CAÑAR;3;AZOGUES;301;JAVIER LOYOLA (CHUQUIPATA);30154;CENTRO DE EDUCACION INICIAL DE INNOVACION UNAE;03H00129;Rural;170;170;0;0
2022-2023 Fin;Zona 6;CAÑAR;3;AZOGUES;301;JAVIER LOYOLA (CHUQUIPATA);30154;ESCUELA DE EDUCACIÓN BÁSICA DANIEL CORDOVA TORAL;03H00130;Rural;184;177;0;7
2022-2023 Fin;Zona 6;CAÑAR;3;AZOGUES;301;JAVIER LOYOLA (CHUQUIPATA);30154;ESCUELA DE EDUCACIÓN BÁSICA CACIQUE TENEMAZA;03H00131;Rural;169;165;1;3
2022-2023 Fin;Zona 6;CAÑAR;3;AZOGUES;301;JAVIER LOYOLA (CHUQUIPATA);30154;JAVIER LOYOLA;03H00132;Rural;461;383;36;42
2022-2023 Fin;Zona 6;CAÑAR;3;AZOGUES;301;JAVIER LOYOLA (CHUQUIPATA);30154;ESCUELA DE EDUCACIÓN BÁSICA VICENTE CABRERA VEGA;03H00133;Rural;5;5;0;0
2022-2023 Fin;Zona 6;CAÑAR;3;AZOGUES;301;JAVIER LOYOLA (CHUQUIPATA);30154;CENTRO DE EDUCACIÓN INICIAL MANUELITA CAÑIZARES;03H00137;Rural;30;30;0;0
2022-2023 Fin;Zona 6;CAÑAR;3;AZOGUES;301;LUIS CORDERO;30155;UNIDAD EDUCATIVA LOS CAÑARIS;03H00142;Rural;447;437;9;1
2022-2023 Fin;Zona 6;CAÑAR;3;AZOGUES;301;LUIS CORDERO;30155;ESCUELA DE EDUCACIÓN BÁSICA REINO DE HOLANDA;03H00143;Rural;14;14;0;0
2022-2023 Fin;Zona 6;CAÑAR;3;AZOGUES;301;LUIS CORDERO;30155;ESCUELA DE EDUCACIÓN BASICA CLEMENTINA ESPINOZA CORDERO;03H00144;Rural;22;22;0;0
2022-2023 Fin;Zona 6;CAÑAR;3;AZOGUES;301;LUIS CORDERO;30155;ESCUELA DE EDUCACIÓN BÁSICA ANTONIO NEUMANE;03H00148;Rural;3;3;0;0
2022-2023 Fin;Zona 6;CAÑAR;3;AZOGUES;301;LUIS CORDERO;30155;ESCUELA DE EDUCACIÓN BÁSICA DOLORES RODAS DE PESÁNTEZ;03H00151;Rural;18;17;0;1
2022-2023 Fin;Zona 6;CAÑAR;3;CAÑAR;303;INGAPIRCA;30356;ESCUELA DE EDUCACION BASICA HUMBERTO MARTINEZ ORBE;03H00153;Rural;24;24;0;0
2022-2023 Fin;Zona 6;CAÑAR;3;AZOGUES;301;PINDILIG;30156;ESCUELA DE EDUCACION BASICA  SIMON RODRIGUEZ;03H00157;Rural;23;22;0;1
2022-2023 Fin;Zona 6;CAÑAR;3;AZOGUES;301;PINDILIG;30156;ESCUELA DE EDUCACIÓN BASICA 2 DE AGOSTO;03H00160;Rural;89;89;0;0
2022-2023 Fin;Zona 6;CAÑAR;3;AZOGUES;301;PINDILIG;30156;ESCUELA DE EDUCACIÓN BASICA CESAR PESANTEZ ROJAS;03H00164;Rural;93;93;0;0
