Año_lectivo;Zona;Provincia;Cod_Provincia;Cantón;Cod_Cantón;Parroquia;Cod_Parroquia;Nombre_Institución;AMIE;Área;Total_estudiantes;Promovidos;No promovidos;Abandono
2022-2023 Fin;Zona 6;AZUAY;1;CUENCA;101;CHAUCHA;10153;ESCUELA DE EDUCACION BASICA SEIS DE JUNIO;01B00021;Rural;10;10;0;0
2022-2023 Fin;Zona 6;AZUAY;1;CUENCA;101;QUINGEO;10161;CECIB DE EDUCACIÓN BÁSICA MONSEÑOR LEONIDAS PROAÑO II;01B00027;Rural;145;145;0;0
2022-2023 Fin;Zona 6;AZUAY;1;CUENCA;101;QUINGEO;10161;CECIB DE EDUCACIÓN BÁSICA EL TEJAR;01B00029;Rural;36;36;0;0
2022-2023 Fin;Zona 6;AZUAY;1;CUENCA;101;RICAURTE;10162;UNIDAD EDUCATIVA PARTICULAR BUENA ESPERANZA;01B00030;Rural;1507;1503;4;0
2022-2023 Fin;Zona 6;AZUAY;1;CUENCA;101;SANTA ANA;10164;CECIB DE EDUCACION BASICA MONTE SINAÍ;01B00031;Rural;45;44;1;0
2022-2023 Fin;Zona 6;AZUAY;1;CUENCA;101;TURI;10169;CECIB DE EDUCACIÓN BÁSICA XAVIER MUÑOZ CHAVEZ;01B00032;Rural;18;18;0;0
2022-2023 Fin;Zona 6;AZUAY;1;CUENCA;101;TURI;10169;CECIB DE EDUCACIÓN BÁSICA CESAR VICTORIANO MARTINEZ VERDUGO;01B00034;Rural;24;24;0;0
2022-2023 Fin;Zona 6;AZUAY;1;CUENCA;101;TURI;10169;CECIB DE EDUCACIÓN BÁSICA MARCO MARTINEZ;01B00035;Rural;25;25;0;0
2022-2023 Fin;Zona 6;AZUAY;1;CUENCA;101;SANTA ANA;10164;CECIB DE EDUCACIÓN BÁSICA  JUAN PEÑAFIEL;01B00036;Rural;80;80;0;0
2022-2023 Fin;Zona 6;AZUAY;1;GUALACEO;103;GUALACEO;10350;CECIB DE EDUCACIÓN BÁSICA MIGUEL IGNACIO CORDERO MONCAYO;01B00037;Urbana;98;96;1;1
2022-2023 Fin;Zona 6;AZUAY;1;GUALACEO;103;SAN JUAN;10357;19 DE MAYO;01B00040;Rural;10;10;0;0
2022-2023 Fin;Zona 6;AZUAY;1;GUALACEO;103;SAN JUAN;10357;CECIB DE EDUCACIÓN BÁSICA LA DOLOROSA;01B00041;Rural;55;54;0;1
2022-2023 Fin;Zona 6;AZUAY;1;GUALACEO;103;ZHIDMAD;10358;CECIB DE EDUCACIÓN BÁSICA RUMIÑAHUI;01B00043;Rural;7;7;0;0
2022-2023 Fin;Zona 6;AZUAY;1;NABON;104;NABON;10450;CECIB DE EDUCACIÓN BÁSICA  EFRAÍN NAULA;01B00045;Urbana;63;63;0;0
2022-2023 Fin;Zona 6;AZUAY;1;NABON;104;NABON;10450;CECIB DE EDUCACIÓN BÁSICA ARTURO QUESADA MENDIETA;01B00046;Urbana;121;121;0;0
2022-2023 Fin;Zona 6;AZUAY;1;NABON;104;NABON;10450;CECIB DE EDUCACION BÁSICA  MONSEÑOR LEONIDAS PROAÑO 1;01B00047;Urbana;88;82;2;4
2022-2023 Fin;Zona 6;AZUAY;1;NABON;104;NABON;10450;CECIB DE EDUCACIÓN BÁSICA SAN JOSE;01B00048;Urbana;62;62;0;0
2022-2023 Fin;Zona 6;AZUAY;1;NABON;104;NABON;10450;CECIB DE EDUCACIÓN BÁSICA JOSÉ ALBERTO MOROCHO;01B00050;Urbana;5;5;0;0
2022-2023 Fin;Zona 6;AZUAY;1;NABON;104;NABON;10450;UNIDAD EDUCATIVA COMUNITARIA INTERCULTURAL BILINGÜE SAN JOSE;01B00051;Urbana;35;35;0;0
2022-2023 Fin;Zona 6;AZUAY;1;NABON;104;NABON;10450;UNIDAD EDUCATIVA BALTAZAR AGUIRRE;01B00052;Urbana;193;193;0;0
2022-2023 Fin;Zona 6;AZUAY;1;NABON;104;NABON;10450;CECIB DE EDUCACIÓN BÁSICA FERNANDO DAQUILEMA;01B00053;Urbana;13;13;0;0
2022-2023 Fin;Zona 6;AZUAY;1;NABON;104;NABON;10450;UNIDAD EDUCATIVA  COMUNITARIA INTERCULTURAL BILINGUE SHIÑA;01B00054;Urbana;226;220;0;6
2022-2023 Fin;Zona 6;AZUAY;1;NABON;104;EL PROGRESO (CAB. EN ZHOTA);10452;ESCUELA DE EDUCACIÓN BÁSICA  LA MERCED;01B00055;Rural;10;10;0;0
2022-2023 Fin;Zona 6;AZUAY;1;SIGSIG;109;LUDO;10954;CECIB DE EDUCACIÓN BÁSICA JAIME ROLDOS AGUILERA;01B00056;Rural;67;67;0;0
2022-2023 Fin;Zona 6;AZUAY;1;OÑA;110;SUSUDEL;11051;CECIB DE EDUCACIÓN BÁSICA NUEVO SUSUDEL;01B00057;Rural;102;102;0;0
2022-2023 Fin;Zona 6;AZUAY;1;CUENCA;101;QUINGEO;10161;CECIB DE EDUCACIÓN BÁSICA JOSE PUZHI;01B00060;Rural;41;37;0;4
2022-2023 Fin;Zona 6;AZUAY;1;CUENCA;101;MOLLETURO;10157;CECIB DE EDUCACIÓN BÁSICA MARIO LEÓN;01B00065;Rural;5;5;0;0
2022-2023 Fin;Zona 6;AZUAY;1;CUENCA;101;QUINGEO;10161;CECIB DE EDUCACIÓN BÁSICA SAN VICENTE;01B00066;Rural;19;19;0;0
2022-2023 Fin;Zona 6;AZUAY;1;NABON;104;NABON;10450;CECIB DE EDUCACIÓN BÁSICA QUILLUSISAPA RICCHARIMUI;01B00067;Urbana;18;18;0;0
2022-2023 Fin;Zona 6;AZUAY;1;CAMILO PONCE ENRIQUEZ;115;CAMILO PONCE ENRIQUEZ;11550;ESCUELA DE EDUCACIÓN BÁSICA 20 DE AGOSTO;01B00069;Urbana;4;4;0;0
2022-2023 Fin;Zona 6;AZUAY;1;OÑA;110;SAN FELIPE DE OÑA;11050;ESCUELA DE EDUCACIÓN BÁSICA 27 DE SEPTIEMBRE;01B00071;Urbana;3;3;0;0
2022-2023 Fin;Zona 6;AZUAY;1;CUENCA;101;QUINGEO;10161;ESCUELA DE EDUCACIÓN BÁSICA MARÍA AYORA PINEDA;01B00072;Rural;42;42;0;0
2022-2023 Fin;Zona 6;AZUAY;1;NABON;104;LAS NIEVES (CHAYA);10453;ESCUELA DE EDUCACIÓN BÁSICA TRIGOPAMBA;01B00073;Rural;3;3;0;0
2022-2023 Fin;Zona 6;AZUAY;1;CUENCA;101;BELLAVISTA;10101;UNIDAD EDUCATIVA PARTICULAR UNITEC DISCOVERY CRISTO REY;01H00001;Urbana;349;349;0;0
2022-2023 Fin;Zona 6;AZUAY;1;CUENCA;101;BELLAVISTA;10101;UNIDAD EDUCATIVA RAFAEL AGUILAR PESANTEZ;01H00003;Urbana;667;625;6;36
2022-2023 Fin;Zona 6;AZUAY;1;CUENCA;101;EL BATAN;10103;UNIDAD EDUCATIVA BENJAMÍN RAMIREZ ARTEAGA;01H00010;Urbana;726;702;14;10
2022-2023 Fin;Zona 6;AZUAY;1;CUENCA;101;BELLAVISTA;10101;ESCUELA DE EDUCACIÓN BÁSICA PARTICULAR NUEVO MILENIO;01H00011;Urbana;70;67;2;1
2022-2023 Fin;Zona 6;AZUAY;1;CUENCA;101;TOTORACOCHA;10113;UNIDAD EDUCATIVA LA INMACULADA;01H00035;Urbana;974;940;34;0
2022-2023 Fin;Zona 6;AZUAY;1;CUENCA;101;BELLAVISTA;10101;UNIDAD EDUCATIVA JULIO MARIA MATOVELLE;01H00037;Urbana;1151;972;46;133
2022-2023 Fin;Zona 6;AZUAY;1;CUENCA;101;BELLAVISTA;10101;ESCUELA DE EDUCACIÓN BÁSICA FEDERICO PROAÑO;01H00043;Urbana;1006;950;31;25
2022-2023 Fin;Zona 6;AZUAY;1;CUENCA;101;BELLAVISTA;10101;UNIDAD EDUCATIVA FRANCISCA DAVILA DE MUÑOZ;01H00046;Urbana;1251;1166;51;34
2022-2023 Fin;Zona 6;AZUAY;1;CUENCA;101;BELLAVISTA;10101;ESCUELA DE EDUCACIÓN BÁSICA FISCOMISIONAL PADRE CARLOS CRESPI;01H00048;Urbana;1667;1662;0;5
2022-2023 Fin;Zona 6;AZUAY;1;CUENCA;101;BELLAVISTA;10101;UNIDAD EDUCATIVA ALBERTO ANDRADE ARIZAGA-BRUMMEL;01H00049;Urbana;619;612;6;1
2022-2023 Fin;Zona 6;AZUAY;1;CUENCA;101;BELLAVISTA;10101;CENTRO DE EDUCACION INICIAL PARTICULAR MAMYS DAY CARE;01H00052;Urbana;14;14;0;0
2022-2023 Fin;Zona 6;AZUAY;1;CUENCA;101;BELLAVISTA;10101;ESCUELA DE EDUCACION BASICA PARTICULAR ENSUEÑOS;01H00054;Urbana;63;63;0;0
2022-2023 Fin;Zona 6;AZUAY;1;CUENCA;101;BELLAVISTA;10101;CENTRO EDUCATIVO INICIAL MUNICIPAL SOL DE TALENTOS;01H00060;Urbana;45;45;0;0
2022-2023 Fin;Zona 6;AZUAY;1;CUENCA;101;BELLAVISTA;10101;UNIDAD EDUCATIVA TRES DE NOVIEMBRE;01H00061;Urbana;1033;948;54;31
2022-2023 Fin;Zona 6;AZUAY;1;CUENCA;101;BELLAVISTA;10101;STEPHEN HAWKING;01H00062;Urbana;47;47;0;0
2022-2023 Fin;Zona 6;AZUAY;1;CUENCA;101;CAÑARIBAMBA;10102;UNIDAD EDUCATIVA ESPECIAL DEL AZUAY;01H00063;Urbana;62;62;0;0
2022-2023 Fin;Zona 6;AZUAY;1;CUENCA;101;CAÑARIBAMBA;10102;CENTRO DE EDUCACION INICIAL PARTICULAR MIS ENANITOS;01H00066;Urbana;9;9;0;0
2022-2023 Fin;Zona 6;AZUAY;1;CUENCA;101;CAÑARIBAMBA;10102;ESCUELA DE EDUCACIÓN BÁSICA JULIO ABAD CHICA;01H00067;Urbana;653;607;3;43
2022-2023 Fin;Zona 6;AZUAY;1;CUENCA;101;MONAY;10109;ESCUELA DE EDUCACIÓN BÁSICA PARTICULAR RAYITO DE LUZ;01H00070;Urbana;27;24;0;3
2022-2023 Fin;Zona 6;AZUAY;1;CUENCA;101;CAÑARIBAMBA;10102;UNIDAD DE EDUCACIÓN ESPECIALIZADA FISCOMISIONAL ADINEA;01H00072;Urbana;63;62;0;1
2022-2023 Fin;Zona 6;AZUAY;1;CUENCA;101;CAÑARIBAMBA;10102;UNIDAD EDUCATIVA ZOILA AURORA PALACIOS;01H00074;Urbana;935;900;25;10
2022-2023 Fin;Zona 6;AZUAY;1;CUENCA;101;CAÑARIBAMBA;10102;UNIDAD EDUCATIVA FISCOMISIONAL JOSE MARIA VELAZ, SJ – IRFEYAL – EXTENSION 3- CUENCA;01H00075;Urbana;44;32;0;12
2022-2023 Fin;Zona 6;AZUAY;1;CUENCA;101;CAÑARIBAMBA;10102;UNIDAD EDUCATIVA CESAR DAVILA ANDRADE;01H00076;Urbana;1219;1205;13;1
2022-2023 Fin;Zona 6;AZUAY;1;CUENCA;101;CAÑARIBAMBA;10102;CENTRO DE EDUCACIÓN INICIAL RITA CHAVEZ DE MUÑOZ;01H00077;Urbana;150;150;0;0
2022-2023 Fin;Zona 6;AZUAY;1;CUENCA;101;EL BATAN;10103;ESCUELA DE EDUCACIÓN BÁSICA DOCE DE ABRIL;01H00082;Urbana;926;872;26;28
2022-2023 Fin;Zona 6;AZUAY;1;CUENCA;101;EL BATAN;10103;ESCUELA DE EDUCACIÓN BÁSICA HERMANO MIGUEL;01H00086;Urbana;313;297;0;16
2022-2023 Fin;Zona 6;AZUAY;1;CUENCA;101;EL BATAN;10103;CENTRO DE EDUCACIÓN INICIAL HERNAN MALO;01H00087;Urbana;176;167;0;9
2022-2023 Fin;Zona 6;AZUAY;1;CUENCA;101;EL BATAN;10103;ESCUELA DE EDUCACIÓN BÁSICA VICTOR MANUEL ALBORNOZ;01H00088;Urbana;752;750;2;0
2022-2023 Fin;Zona 6;AZUAY;1;CUENCA;101;EL BATAN;10103;CENTRO DE EDUCACIÓN INICIAL PARTICULAR JOSÉ FIDEL HIDALGO;01H00089;Urbana;33;32;0;1
2022-2023 Fin;Zona 6;AZUAY;1;CUENCA;101;EL BATAN;10103;UNIDAD EDUCATIVA PARTICULAR BENJAMÍN BRITTEN;01H00091;Urbana;14;14;0;0
2022-2023 Fin;Zona 6;AZUAY;1;CUENCA;101;MACHANGARA;10108;UNIDAD EDUCATIVA GABRIEL CEVALLOS GARCIA;01H00100;Urbana;713;707;6;0
2022-2023 Fin;Zona 6;AZUAY;1;CUENCA;101;EL SAGRARIO;10104;UNIDAD EDUCATIVA DOLORES J TORRES;01H00112;Urbana;932;893;19;20
2022-2023 Fin;Zona 6;AZUAY;1;CUENCA;101;EL SAGRARIO;10104;UNIDAD EDUCATIVA PARTICULAR SALESIANA MARIA AUXILIADORA;01H00113;Urbana;963;951;0;12
2022-2023 Fin;Zona 6;AZUAY;1;CUENCA;101;YANUNCAY;10114;UNIDAD EDUCATIVA OTTO AROSEMENA GOMEZ;01H00116;Urbana;816;789;27;0
2022-2023 Fin;Zona 6;AZUAY;1;CUENCA;101;EL SAGRARIO;10104;UNIDAD EDUCATIVA PARTICULAR CORAZÓN DE MARÍA;01H00117;Urbana;990;976;8;6
2022-2023 Fin;Zona 6;AZUAY;1;CUENCA;101;EL SAGRARIO;10104;ESCUELA DE EDUCACIÓN BÁSICA FISCOMISIONAL SAGRADO CORAZÓN;01H00119;Urbana;666;666;0;0
2022-2023 Fin;Zona 6;AZUAY;1;CUENCA;101;EL SAGRARIO;10104;UNIDAD EDUCATIVA PARTICULAR MISIONEROS OBLATOS;01H00120;Urbana;374;369;0;5
2022-2023 Fin;Zona 6;AZUAY;1;CUENCA;101;YANUNCAY;10114;UNIDAD EDUCATIVA CIUDAD DE CUENCA;01H00122;Urbana;900;855;27;18
2022-2023 Fin;Zona 6;AZUAY;1;CUENCA;101;GIL RAMIREZ DAVALOS;10106;CENTRO DE EDUCACION INICIAL CIUDAD DE CUENCA;01H00127;Urbana;225;225;0;0
2022-2023 Fin;Zona 6;AZUAY;1;CUENCA;101;EL VECINO;10105;CENTRO DE EDUCACION INICIAL PARTICULAR NUESTRO MUNDO;01H00132;Urbana;18;18;0;0
2022-2023 Fin;Zona 6;AZUAY;1;CUENCA;101;EL VECINO;10105;UNIDAD EDUCATIVA PARTICULAR CARLOS CRESPI II;01H00136;Urbana;290;285;2;3
2022-2023 Fin;Zona 6;AZUAY;1;CUENCA;101;HERMANO MIGUEL;10115;UNIDAD EDUCATIVA LUIS MONSALVE POZO;01H00140;Urbana;217;203;0;14
2022-2023 Fin;Zona 6;AZUAY;1;CUENCA;101;EL VECINO;10105;UNIDAD EDUCATIVA ZOILA ESPERANZA PALACIO;01H00145;Urbana;1377;1248;52;77
2022-2023 Fin;Zona 6;AZUAY;1;CUENCA;101;EL VECINO;10105;COLEGIO DE BACHILLERATO PARTICULAR CARLOS CRESPI;01H00146;Urbana;12;7;1;4
2022-2023 Fin;Zona 6;AZUAY;1;CUENCA;101;EL VECINO;10105;ESCUELA DE EDUCACION BASICA MARY CORYLE;01H00148;Urbana;311;297;2;12
2022-2023 Fin;Zona 6;AZUAY;1;CUENCA;101;EL VECINO;10105;CENTRO DE EDUCACIÓN INICIAL PARTICULAR ABEJITAS LABORIOSAS;01H00149;Urbana;5;5;0;0
2022-2023 Fin;Zona 6;AZUAY;1;CUENCA;101;EL VECINO;10105;UNIDAD EDUCATIVA LUIS ROBERTO BRAVO;01H00150;Urbana;740;720;15;5
2022-2023 Fin;Zona 6;AZUAY;1;CUENCA;101;EL VECINO;10105;UNIDAD EDUCATIVA REPUBLICA DE CHILE;01H00153;Urbana;493;470;7;16
2022-2023 Fin;Zona 6;AZUAY;1;CUENCA;101;EL VECINO;10105;UNIDAD EDUCATIVA JUAN MONTALVO;01H00155;Urbana;1186;1093;73;20
2022-2023 Fin;Zona 6;AZUAY;1;CUENCA;101;GIL RAMIREZ DAVALOS;10106;ESCUELA DE EDUCACION BASICA PARTICULAR LICEO DEL AZUAY;01H00162;Urbana;16;16;0;0
2022-2023 Fin;Zona 6;AZUAY;1;CUENCA;101;GIL RAMIREZ DAVALOS;10106;UNIDAD EDUCATIVA PARTICULAR DOMINICANA SAN LUIS BELTRAN;01H00164;Urbana;341;334;0;7
2022-2023 Fin;Zona 6;AZUAY;1;CUENCA;101;GIL RAMIREZ DAVALOS;10106;UNIDAD EDUCATIVA SAN FRANCISCO;01H00165;Urbana;827;825;1;1
2022-2023 Fin;Zona 6;AZUAY;1;CUENCA;101;GIL RAMIREZ DAVALOS;10106;UNIDAD EDUCATIVA PARTICULAR SANTA MARIANA DE JESÚS;01H00172;Urbana;1251;1234;3;14
2022-2023 Fin;Zona 6;AZUAY;1;CUENCA;101;GIL RAMIREZ DAVALOS;10106;ESCUELA DE EDUCACIÓN BÁSICA FISCOMISIONAL DANIEL HERMIDA;01H00174;Urbana;236;232;0;4
2022-2023 Fin;Zona 6;AZUAY;1;CUENCA;101;GIL RAMIREZ DAVALOS;10106;UNIDAD EDUCATIVA OCTAVIO CORDERO PALACIOS;01H00187;Urbana;775;709;8;58
2022-2023 Fin;Zona 6;AZUAY;1;CUENCA;101;BELLAVISTA;10101;UNIDAD EDUCATIVA PARTICULAR CATOLICA DE CUENCA;01H00188;Urbana;727;713;3;11
2022-2023 Fin;Zona 6;AZUAY;1;CUENCA;101;HUAYNACAPAC;10107;ESCUELA DE EDUCACIÓN BÁSICA GABRIELA  MISTRAL;01H00190;Urbana;481;474;0;7
2022-2023 Fin;Zona 6;AZUAY;1;CUENCA;101;HUAYNACAPAC;10107;COLEGIO DE BACHILLERATO DANIEL CORDOVA  TORAL;01H00196;Urbana;808;779;7;22
2022-2023 Fin;Zona 6;AZUAY;1;CUENCA;101;HUAYNACAPAC;10107;UNIDAD EDUCATIVA PARTICULAR HERMANO MIGUEL  DE LA SALLE;01H00199;Urbana;1949;1938;2;9
2022-2023 Fin;Zona 6;AZUAY;1;CUENCA;101;HUAYNACAPAC;10107;ESCUELA DE EDUCACIÓN BÁSICA REPÚBLICA DE COLOMBIA;01H00203;Urbana;290;279;7;4
2022-2023 Fin;Zona 6;AZUAY;1;CUENCA;101;HUAYNACAPAC;10107;UNIDAD EDUCATIVA FISCOMISIONAL JOSE MARIA VELAZ, SJ – IRFEYAL – EXTENSION 68- B- GAPAL;01H00204;Urbana;25;23;0;2
2022-2023 Fin;Zona 6;AZUAY;1;CUENCA;101;HUAYNACAPAC;10107;CENTRO DE EDUCACIÓN INICIAL CARLOS ZAMBRANO OREJUELA;01H00205;Urbana;194;186;0;8
2022-2023 Fin;Zona 6;AZUAY;1;CUENCA;101;HUAYNACAPAC;10107;UNIDAD EDUCATIVA FISCOMISIONAL FE Y ALEGRIA;01H00209;Urbana;890;890;0;0
2022-2023 Fin;Zona 6;AZUAY;1;CUENCA;101;YANUNCAY;10114;UNIDAD EDUCATIVA PARTICULAR LA ASUNCION;01H00213;Urbana;2643;2643;0;0
2022-2023 Fin;Zona 6;AZUAY;1;CUENCA;101;YANUNCAY;10114;CENTRO DE EDUCACIÓN INICIAL PARTICULAR LA COMETA;01H00220;Urbana;35;34;0;1
2022-2023 Fin;Zona 6;AZUAY;1;CUENCA;101;HUAYNACAPAC;10107;ESCUELA DE EDUCACIÓN BÁSICA FISCOMISIONAL SAN JOSÉ DE CALASANZ;01H00221;Urbana;57;57;0;0
2022-2023 Fin;Zona 6;AZUAY;1;CUENCA;101;HUAYNACAPAC;10107;CENTRO DE EDUCACION INICIAL MUNICIPAL CEDEI 27 DE FEBRERO;01H00222;Urbana;29;27;0;2
2022-2023 Fin;Zona 6;AZUAY;1;CUENCA;101;HUAYNACAPAC;10107;CENTRO DE EDUCACION INICIAL PARTICULAR TRAVESURAS;01H00224;Urbana;16;16;0;0
2022-2023 Fin;Zona 6;AZUAY;1;CUENCA;101;MACHANGARA;10108;UNIDAD DE EDUCACIÓN ESPECIAL CLAUDIO NEIRA GARZON;01H00226;Urbana;27;27;0;0
2022-2023 Fin;Zona 6;AZUAY;1;CUENCA;101;HUAYNACAPAC;10107;UNIDAD EDUCATIVA ESPECIAL AGUSTIN CUEVA TAMARIZ;01H00227;Urbana;185;185;0;0
2022-2023 Fin;Zona 6;AZUAY;1;CUENCA;101;HUAYNACAPAC;10107;CENTRO DE EDUCACIÓN INICIAL PARTICULAR ATRAPA SUEÑOS;01H00229;Urbana;26;26;0;0
2022-2023 Fin;Zona 6;AZUAY;1;CUENCA;101;SAN SEBASTIAN;10111;UNIDAD EDUCATIVA PARTICULAR AUSUBEL HIGH SCHOOL;01H00231;Urbana;685;678;0;7
2022-2023 Fin;Zona 6;AZUAY;1;CUENCA;101;MACHANGARA;10108;UNIDAD EDUCATIVA MARIO RIZZINI;01H00233;Urbana;764;760;4;0
2022-2023 Fin;Zona 6;AZUAY;1;CUENCA;101;MACHANGARA;10108;UNIDAD EDUCATIVA CAZADORES DE LOS RIOS;01H00237;Urbana;809;797;11;1
2022-2023 Fin;Zona 6;AZUAY;1;CUENCA;101;MACHANGARA;10108;UNIDAD EDUCATIVA FISCOMISIONAL JUAN BAUTISTA STIEHLE;01H00238;Urbana;197;188;0;9
2022-2023 Fin;Zona 6;AZUAY;1;CUENCA;101;MACHANGARA;10108;UNIDAD EDUCATIVA PARTICULAR KENNEDY;01H00241;Urbana;887;872;1;14
2022-2023 Fin;Zona 6;AZUAY;1;CUENCA;101;VALLE;10170;ESCUELA DE EDUCACIÓN BÁSICA CATALINA GUERRERO;01H00253;Rural;284;263;20;1
2022-2023 Fin;Zona 6;AZUAY;1;CUENCA;101;MONAY;10109;UNIDAD EDUCATIVA PARTICULAR COREL;01H00258;Urbana;243;243;0;0
2022-2023 Fin;Zona 6;AZUAY;1;CUENCA;101;MONAY;10109;ESCUELA DE EDUCACION BASICA ANDRES F CORDOVA;01H00259;Urbana;162;159;3;0
2022-2023 Fin;Zona 6;AZUAY;1;CUENCA;101;MONAY;10109;UNIDAD EDUCATIVA PARTICULAR LATINOAMERICANO;01H00265;Urbana;743;741;1;1
2022-2023 Fin;Zona 6;AZUAY;1;CUENCA;101;RICAURTE;10162;UNIDAD EDUCATIVA PARTICULAR SUDAMERICANO;01H00271;Rural;762;745;5;12
2022-2023 Fin;Zona 6;AZUAY;1;CUENCA;101;SAN BLAS;10110;ESCUELA DE EDUCACIÓN BÁSICA LUIS CORDERO CRESPO;01H00272;Urbana;1499;1440;21;38
2022-2023 Fin;Zona 6;AZUAY;1;CUENCA;101;SAN BLAS;10110;CENTRO DE EDUCACIÓN INICIAL PARTICULAR MI CASITA;01H00276;Urbana;39;39;0;0
2022-2023 Fin;Zona 6;AZUAY;1;CUENCA;101;SAN BLAS;10110;UNIDAD EDUCATIVA FISCOMISIONAL SOR  TERESA VALSE;01H00277;Urbana;1071;1051;8;12
2022-2023 Fin;Zona 6;AZUAY;1;CUENCA;101;SAN BLAS;10110;ESCUELA DE EDUCACIÓN BÁSICA MANUELA CAÑIZARES;01H00281;Urbana;537;515;9;13
2022-2023 Fin;Zona 6;AZUAY;1;CUENCA;101;CAÑARIBAMBA;10102;UNIDAD EDUCATIVA FISCOMISIONAL SEMIPRESENCIAL DEL AZUAY;01H00283;Urbana;883;685;3;195
2022-2023 Fin;Zona 6;AZUAY;1;CUENCA;101;GIL RAMIREZ DAVALOS;10106;CENTRO DE EDUCACION INICIAL MUNICIPAL 10 DE AGOSTO;01H00286;Urbana;30;29;0;1
2022-2023 Fin;Zona 6;AZUAY;1;CUENCA;101;SAN SEBASTIAN;10111;UNIDAD EDUCATIVA PARTICULAR SAGRADOS CORAZONES;01H00296;Urbana;731;725;0;6
2022-2023 Fin;Zona 6;AZUAY;1;CUENCA;101;SAN SEBASTIAN;10111;UNIDAD EDUCATIVA PARTICULAR SANTANA;01H00300;Urbana;766;757;2;7
2022-2023 Fin;Zona 6;AZUAY;1;CUENCA;101;SAN SEBASTIAN;10111;UNIDAD EDUCATIVA FISCOMISIONAL JOSE MARIA VELAZ SJ IRFEYAL EXTENSION 105- CUENCA;01H00301;Urbana;18;18;0;0
2022-2023 Fin;Zona 6;AZUAY;1;CUENCA;101;SAN SEBASTIAN;10111;ESCUELA DE EDUCACIÓN BÁSICA EMILIO MURILLO;01H00305;Urbana;325;313;4;8
2022-2023 Fin;Zona 6;AZUAY;1;CUENCA;101;SAN SEBASTIAN;10111;UNIDAD EDUCATIVA PARTICULAR LICEO CRISTIANO DE CUENCA;01H00312;Urbana;543;526;4;13
2022-2023 Fin;Zona 6;AZUAY;1;CUENCA;101;SAN SEBASTIAN;10111;UNIDAD EDUCATIVA VICTOR GERARDO AGUILAR;01H00314;Urbana;1124;998;74;52
2022-2023 Fin;Zona 6;AZUAY;1;CUENCA;101;SAN SEBASTIAN;10111;ESCUELA DE EDUCACIÓN BÁSICA ÁNGELA RODRÍGUEZ;01H00322;Urbana;248;246;1;1
2022-2023 Fin;Zona 6;AZUAY;1;CUENCA;101;SAN SEBASTIAN;10111;UNIDAD EDUCATIVA PARTICULAR  LAS PENCAS;01H00324;Urbana;512;497;0;15
2022-2023 Fin;Zona 6;AZUAY;1;CUENCA;101;SAN SEBASTIAN;10111;ESCUELA DE EDUCACIÓN BÁSICA REINALDO CHICO GARCÍA;01H00326;Urbana;536;533;3;0
2022-2023 Fin;Zona 6;AZUAY;1;CUENCA;101;SAN SEBASTIAN;10111;ESCUELA DE EDUCACIÓN BÁSICA IGNACIO MALO TAMARÍZ;01H00329;Urbana;251;246;0;5
2022-2023 Fin;Zona 6;AZUAY;1;CUENCA;101;SAN SEBASTIAN;10111;CENTRO DE EDUCACIÓN INICIAL ANTONIO BORRERO VEGA;01H00330;Urbana;173;165;0;8
2022-2023 Fin;Zona 6;AZUAY;1;CUENCA;101;SAN SEBASTIAN;10111;UNIDAD EDUCATIVA REPÚBLICA DE ECUADOR;01H00335;Urbana;1148;1014;50;84
2022-2023 Fin;Zona 6;AZUAY;1;CUENCA;101;SAN SEBASTIAN;10111;COLEGIO DE BACHILLERATO CIUDAD DE CUENCA;01H00336;Urbana;934;934;0;0
2022-2023 Fin;Zona 6;AZUAY;1;CUENCA;101;SAN SEBASTIAN;10111;UNIDAD EDUCATIVA PARTICULAR MADRID;01H00338;Urbana;122;121;0;1
2022-2023 Fin;Zona 6;AZUAY;1;CUENCA;101;SAN SEBASTIAN;10111;UNIDAD EDUCATIVA PARTICULAR BELL ACADEMY;01H00339;Urbana;366;364;0;2
2022-2023 Fin;Zona 6;AZUAY;1;CUENCA;101;SAN SEBASTIAN;10111;ESCUELA DE EDUCACIÓN BÁSICA ULISES CHACON;01H00343;Urbana;491;476;2;13
2022-2023 Fin;Zona 6;AZUAY;1;CUENCA;101;SAN SEBASTIAN;10111;UNIDAD EDUCATIVA FISCOMISIONAL MADRE ENRIQUETA AYMER SSCC;01H00346;Urbana;341;336;0;5
2022-2023 Fin;Zona 6;AZUAY;1;CUENCA;101;SAN SEBASTIAN;10111;CENTRO DE EDUCACIÓN INICIAL MUNICIPAL  EL CEBOLLAR;01H00347;Urbana;23;22;0;1
2022-2023 Fin;Zona 6;AZUAY;1;CUENCA;101;SAN SEBASTIAN;10111;CENTRO DE EDUCACIÓN INICIAL PARTICULAR KINDER GARDEN;01H00351;Urbana;31;31;0;0
2022-2023 Fin;Zona 6;AZUAY;1;CUENCA;101;SUCRE;10112;UNIDAD EDUCATIVA FISCOMISIONAL LUISA DE JESÚS CORDERO;01H00358;Urbana;997;992;5;0
2022-2023 Fin;Zona 6;AZUAY;1;CUENCA;101;SUCRE;10112;UNIDAD EDUCATIVA REMIGIO ROMERO Y CORDERO;01H00363;Urbana;685;626;41;18
2022-2023 Fin;Zona 6;AZUAY;1;CUENCA;101;SUCRE;10112;CENTRO DE EDUCACIÓN INICIAL PARTICULAR ESTRELLITAS;01H00364;Urbana;43;43;0;0
2022-2023 Fin;Zona 6;AZUAY;1;CUENCA;101;SUCRE;10112;CENTRO DE EDUCACIÓN INICIAL PARTICULAR SENDERITOS DEL SABER;01H00368;Urbana;9;8;0;1
2022-2023 Fin;Zona 6;AZUAY;1;CUENCA;101;SUCRE;10112;UNIDAD EDUCATIVA PARTICULAR NUESTRA FAMILIA;01H00374;Urbana;652;642;4;6
2022-2023 Fin;Zona 6;AZUAY;1;CUENCA;101;SUCRE;10112;UNIDAD EDUCATIVA PARTICULAR BILINGUE INTERAMERICANA;01H00377;Urbana;1509;1477;6;26
2022-2023 Fin;Zona 6;AZUAY;1;CUENCA;101;SUCRE;10112;UNIDAD EDUCATIVA FISCOMISIONAL SAN ROQUE;01H00378;Urbana;248;247;0;1
2022-2023 Fin;Zona 6;AZUAY;1;CUENCA;101;SUCRE;10112;UNIDAD EDUCATIVA EUGENIO ESPEJO;01H00379;Urbana;840;840;0;0
2022-2023 Fin;Zona 6;AZUAY;1;CUENCA;101;SUCRE;10112;UNIDAD EDUCATIVA ANTONIO ÁVILA MALDONADO;01H00381;Urbana;1083;989;47;47
2022-2023 Fin;Zona 6;AZUAY;1;CUENCA;101;SUCRE;10112;ESCUELA DE EDUCACIÓN BÁSICA ÁNGEL POLIVIO CHÁVEZ;01H00385;Urbana;491;490;1;0
2022-2023 Fin;Zona 6;AZUAY;1;CUENCA;101;SUCRE;10112;ESCUELA DE EDUCACIÓN BÁSICA PANAMÁ;01H00389;Urbana;837;813;18;6
2022-2023 Fin;Zona 6;AZUAY;1;CUENCA;101;SUCRE;10112;COLEGIO DE BACHILLERATO BENIGNO MALO;01H00391;Urbana;1278;1277;1;0
2022-2023 Fin;Zona 6;AZUAY;1;CUENCA;101;SUCRE;10112;UNIDAD EDUCATIVA MIGUEL MERCHAN OCHOA;01H00394;Urbana;720;655;35;30
2022-2023 Fin;Zona 6;AZUAY;1;CUENCA;101;SUCRE;10112;CENTRO DE EDUCACIÓN INICIAL PARTICULAR INFANCIA FELIZ;01H00396;Urbana;4;4;0;0
2022-2023 Fin;Zona 6;AZUAY;1;CUENCA;101;TOTORACOCHA;10113;ESCUELA DE EDUCACIÓN BÁSICA PARTICULAR CDI;01H00402;Urbana;106;106;0;0
2022-2023 Fin;Zona 6;AZUAY;1;CUENCA;101;TOTORACOCHA;10113;UNIDAD EDUCATIVA HERLINDA TORAL;01H00413;Urbana;2256;2246;9;1
2022-2023 Fin;Zona 6;AZUAY;1;CUENCA;101;TOTORACOCHA;10113;CENTRO DE EDUCACION INICIAL TOTORACOCHA;01H00414;Urbana;155;155;0;0
2022-2023 Fin;Zona 6;AZUAY;1;CUENCA;101;TOTORACOCHA;10113;UNIDAD EDUCATIVA GASPAR SANGURIMA;01H00419;Urbana;102;80;11;11
2022-2023 Fin;Zona 6;AZUAY;1;CUENCA;101;TOTORACOCHA;10113;UNIDAD EDUCATIVA ABELARDO TAMARIZ CRESPO;01H00420;Urbana;839;839;0;0
2022-2023 Fin;Zona 6;AZUAY;1;CUENCA;101;YANUNCAY;10114;ESCUELA DE EDUCACIÓN BÁSICA PARTICULAR LICEO DECROLIANO INTERNACIONAL;01H00428;Urbana;76;76;0;0
2022-2023 Fin;Zona 6;AZUAY;1;CUENCA;101;YANUNCAY;10114;UNIDAD EDUCATIVA MIGUEL MORENO ORDOÑEZ;01H00429;Urbana;923;882;16;25
2022-2023 Fin;Zona 6;AZUAY;1;CUENCA;101;YANUNCAY;10114;UNIDAD EDUCATIVA PARTICULAR LICEO AMERICANO CATÓLICO;01H00437;Urbana;665;657;0;8
2022-2023 Fin;Zona 6;AZUAY;1;CUENCA;101;YANUNCAY;10114;ESCUELA DE EDUCACIÓN BÁSICA JOSÉ MARÍA VELASCO IBARRA;01H00442;Urbana;568;567;0;1
2022-2023 Fin;Zona 6;AZUAY;1;CUENCA;101;YANUNCAY;10114;UNIDAD EDUCATIVA PARTICULAR YANUNCAY;01H00445;Urbana;61;59;2;0
2022-2023 Fin;Zona 6;AZUAY;1;CUENCA;101;YANUNCAY;10114;UNIDAD EDUCATIVA PARTICULAR PRINCIPE DE PAZ;01H00446;Urbana;139;136;0;3
2022-2023 Fin;Zona 6;AZUAY;1;CUENCA;101;YANUNCAY;10114;UNIDAD EDUCATIVA PARTICULAR JUAN PABLO II;01H00448;Urbana;697;697;0;0
2022-2023 Fin;Zona 6;AZUAY;1;CUENCA;101;YANUNCAY;10114;UNIDAD EDUCATIVA  PARTICULAR INTEGRACION IBEROAMERICANO;01H00451;Urbana;92;91;1;0
2022-2023 Fin;Zona 6;AZUAY;1;CUENCA;101;YANUNCAY;10114;CENTRO DE EDUCACIÓN INICIAL ABC;01H00454;Urbana;342;325;0;17
2022-2023 Fin;Zona 6;AZUAY;1;CUENCA;101;YANUNCAY;10114;UNIDAD EDUCATIVA PARTICULAR PORVENIR;01H00456;Urbana;269;266;1;2
2022-2023 Fin;Zona 6;AZUAY;1;CUENCA;101;YANUNCAY;10114;CENTRO DE EDUCACIÓN INICIAL PARTICULAR ARCO DEL SABER;01H00460;Urbana;10;10;0;0
2022-2023 Fin;Zona 6;AZUAY;1;CUENCA;101;YANUNCAY;10114;ESCUELA DE EDUCACIÓN BÁSICA PARTICULAR NOVA;01H00462;Urbana;64;60;4;0
2022-2023 Fin;Zona 6;AZUAY;1;CUENCA;101;YANUNCAY;10114;ESCUELA DE EDUCACIÓN BÁSICA FRANCISCA ARÍZAGA T.;01H00463;Urbana;520;512;7;1
2022-2023 Fin;Zona 6;AZUAY;1;CUENCA;101;YANUNCAY;10114;ESCUELA DE EDUCACIÓN BÁSICA NICOLAS SOJOS;01H00470;Urbana;667;664;3;0
2022-2023 Fin;Zona 6;AZUAY;1;CUENCA;101;YANUNCAY;10114;UNIDAD EDUCATIVA  FISCOMISIONAL TECNICO SALESIANO;01H00475;Urbana;2301;2254;24;23
2022-2023 Fin;Zona 6;AZUAY;1;CUENCA;101;YANUNCAY;10114;UNIDAD EDUCATIVA FRAY VICENTE SOLANO;01H00476;Urbana;1461;1322;92;47
2022-2023 Fin;Zona 6;AZUAY;1;CUENCA;101;YANUNCAY;10114;UNIDAD EDUCATIVA LEONCIO CORDERO JARAMILLO;01H00477;Urbana;814;768;37;9
2022-2023 Fin;Zona 6;AZUAY;1;CUENCA;101;YANUNCAY;10114;ESCUELA DE EDUCACIÓN BÁSICA IGNACIO ESCANDON;01H00478;Urbana;836;836;0;0
2022-2023 Fin;Zona 6;AZUAY;1;CUENCA;101;HERMANO MIGUEL;10115;ESCUELA DE EDUCACIÓN BÁSICA PADRE JUAN BAUTISTA AGUIRRE;01H00479;Urbana;443;443;0;0
2022-2023 Fin;Zona 6;AZUAY;1;CUENCA;101;HERMANO MIGUEL;10115;ESCUELA DE EDUCACION BASICA HECTOR SEMPERTEGUI GARCIA;01H00480;Urbana;179;167;5;7
2022-2023 Fin;Zona 6;AZUAY;1;CUENCA;101;HERMANO MIGUEL;10115;CENTRO DE EDUCACION INICIAL LUIS CORDERO CRESPO;01H00481;Urbana;160;159;0;1
2022-2023 Fin;Zona 6;AZUAY;1;CUENCA;101;HERMANO MIGUEL;10115;UNIDAD EDUCATIVA CARLOS RIGOBERTO VINTIMILLA;01H00486;Urbana;1057;1054;0;3
2022-2023 Fin;Zona 6;AZUAY;1;CUENCA;101;HERMANO MIGUEL;10115;UNIDAD EDUCATIVA PARTICULAR PIO XII;01H00489;Urbana;766;763;0;3
2022-2023 Fin;Zona 6;AZUAY;1;CUENCA;101;HERMANO MIGUEL;10115;UNIDAD EDUCATIVA ISABEL MOSCOSO DÁVILA;01H00491;Urbana;916;848;58;10
2022-2023 Fin;Zona 6;AZUAY;1;CUENCA;101;BAÑOS;10151;ESCUELA DE EDUCACIÓN BÁSICA ALFONSO CARRIÓN HEREDIA;01H00497;Rural;756;733;2;21
2022-2023 Fin;Zona 6;AZUAY;1;CUENCA;101;BAÑOS;10151;ESCUELA DE EDUCACIÓN BÁSICA SEGUNDO ESPINOSA CALLE;01H00503;Rural;151;149;1;1
2022-2023 Fin;Zona 6;AZUAY;1;CUENCA;101;BAÑOS;10151;ESCUELA DE EDUCACION BASICA MEDARDO NEIRA GARZON;01H00508;Rural;171;157;5;9
2022-2023 Fin;Zona 6;AZUAY;1;CUENCA;101;BAÑOS;10151;ESCUELA DE EDUCACIÓN BÁSICA AGUSTÍN CARRIÓN HEREDIA;01H00509;Rural;120;116;0;4
2022-2023 Fin;Zona 6;AZUAY;1;CUENCA;101;BAÑOS;10151;ESCUELA DE EDUCACIÓN BÁSICA ENRIQUETA CORDERO DÁVILA;01H00511;Rural;818;818;0;0
2022-2023 Fin;Zona 6;AZUAY;1;CUENCA;101;BAÑOS;10151;UNIDAD EDUCATIVA AGUSTIN CUESTA VINTIMILLA;01H00514;Rural;374;358;8;8
2022-2023 Fin;Zona 6;AZUAY;1;CUENCA;101;BAÑOS;10151;UNIDAD EDUCATIVA PARTICULAR BORJA;01H00515;Rural;1297;1296;1;0
2022-2023 Fin;Zona 6;AZUAY;1;CUENCA;101;BAÑOS;10151;UNIDAD EDUCATIVA PARTICULAR CEDFI;01H00520;Rural;445;442;1;2
2022-2023 Fin;Zona 6;AZUAY;1;CUENCA;101;BAÑOS;10151;COLEGIO DE BACHILLERATO MANUEL CORDOVA GALARZA;01H00523;Rural;485;414;19;52
2022-2023 Fin;Zona 6;AZUAY;1;CUENCA;101;BAÑOS;10151;ESCUELA DE EDUCACIÓN BÁSICA JOEL MONROY;01H00524;Rural;269;250;0;19
2022-2023 Fin;Zona 6;AZUAY;1;CUENCA;101;BAÑOS;10151;ESCUELA DE EDUCACIÓN BÁSICA SAN JUAN DE JERUSALÉN;01H00530;Rural;340;336;0;4
2022-2023 Fin;Zona 6;AZUAY;1;CUENCA;101;BAÑOS;10151;ESCUELA DE EDUCACIÓN BÁSICA CORNELIO CRESPO TORAL;01H00542;Rural;271;238;0;33
2022-2023 Fin;Zona 6;AZUAY;1;CUENCA;101;CUMBE;10152;ESCUELA DE EDUCACION BASICA JOSE RAFAEL BURBANO VASQUEZ;01H00547;Rural;21;21;0;0
2022-2023 Fin;Zona 6;AZUAY;1;CUENCA;101;CUMBE;10152;UNIDAD EDUCATIVA CUMBE;01H00550;Rural;610;562;10;38
2022-2023 Fin;Zona 6;AZUAY;1;CUENCA;101;CUMBE;10152;ESCUELA DE EDUCACION BASICA CARLOS TERAN ZENTENO;01H00551;Rural;371;363;1;7
